{
  "schemaVersion": 1,
  "capabilityId": "strategy-planning",
  "taskId": "20260728-002-helmsman-strategy",
  "enterpriseId": "ai-digital-employee-control-center",
  "version": 1,
  "status": "candidate",
  "upstreamAnalysis": {
    "capabilityId": "enterprise-analysis",
    "enterpriseId": "ai-digital-employee-control-center",
    "taskId": "20260728-001-control-center-analysis",
    "version": 1,
    "sha256": "9a88130484ac499813083b9d567084267caf77121c2410984483400d3ef7d9eb",
    "status": "candidate",
    "coreProblemRefs": [
      "缺少按真实业务价值和验证证据排序的组织升级路线图",
      "缺少支持商业模式判断的真实客户与财务指标基线",
      "缺少五组织联合完成真实跨组织经营任务的验证证据"
    ]
  },
  "evidenceLedger": [
    {
      "id": "E-001",
      "factClass": "fact",
      "statement": "控制中心固定登记五个业务组织和十五个核心技能",
      "sourceRef": "control-center/registries/organizations.json"
    },
    {
      "id": "E-002",
      "factClass": "fact",
      "statement": "未达到operational的组织不得承接正式执行并继续使用fallback_existing",
      "sourceRef": "AGENTS.md"
    },
    {
      "id": "E-003",
      "factClass": "fact",
      "statement": "AI掌舵官第一阶段只实施企业分析，战略规划和商业模式此前保持designing",
      "sourceRef": "organizations/ai-helmsman/DECISIONS.md#H-001"
    },
    {
      "id": "E-004",
      "factClass": "fact",
      "statement": "飞书知识原文把完整服务描述为从定位、课程、模式、内容、流量到发售交付的阶段链路，并强调跨团队配合",
      "sourceRef": "https://bvvbkaq8l6.feishu.cn/wiki/Oy8awUAsfiOKJ2khT3DcgYvrnGe"
    },
    {
      "id": "E-005",
      "factClass": "inference",
      "statement": "对本项目而言，先完成一个可追溯的三技能决策闭环，比同时扩张全部组织更便于验证和复用",
      "sourceRef": "E-001+E-002+E-003+E-004"
    },
    {
      "id": "E-006",
      "factClass": "unknown",
      "statement": "真实外部客户、付费意愿、收入、成本和交付效率仍未知",
      "sourceRef": "organizations/ai-helmsman/enterprises/ai-digital-employee-control-center/profile.json"
    }
  ],
  "strategicQuestion": "未来90天应先完成AI掌舵官三技能可验证闭环，还是同步扩大五个组织的正式能力覆盖",
  "strategicOptions": [
    {
      "id": "option-focus-helmsman",
      "title": "聚焦AI掌舵官三技能闭环",
      "thesis": "先让企业分析、战略规划和商业模式形成可重复的决策链，再用真实任务推动其他组织成熟",
      "evidenceRefs": [
        "E-002",
        "E-003",
        "E-005",
        "E-006"
      ],
      "tradeOffs": [
        "未来90天不把五个组织同时升级为正式接单",
        "短期能力覆盖面小于并行扩张方案"
      ],
      "resourceRequirements": [
        "优先投入掌舵官三技能契约、真实试运行、回归测试与帝王验收",
        "控制中心继续保留未成熟组织的回退路由"
      ],
      "risks": [
        "若缺少真实企业任务，内部验证无法证明外部商业价值"
      ]
    },
    {
      "id": "option-expand-all",
      "title": "同步扩大五组织能力覆盖",
      "thesis": "同时推进多个组织可更快形成表面覆盖，但会分散真实试运行和维护资源",
      "evidenceRefs": [
        "E-001",
        "E-002",
        "E-003",
        "E-006"
      ],
      "tradeOffs": [
        "牺牲单一能力链路的验证深度",
        "增加跨组织状态、测试与维护复杂度"
      ],
      "resourceRequirements": [
        "多个组织同时建设Workflow、Skill、契约和真实任务",
        "更高的回归测试与故障修复容量"
      ],
      "risks": [
        "容易把目录和名称齐全误认为真实能力成熟"
      ]
    }
  ],
  "priorityOrder": [
    "option-focus-helmsman",
    "option-expand-all"
  ],
  "recommendation": {
    "optionId": "option-focus-helmsman",
    "rationale": "现有证据支持先把AI掌舵官的三项决策能力做成真实闭环，再用它统一判断其他组织的建设优先级",
    "opportunityCosts": [
      "短期放弃五组织同步扩张的覆盖速度",
      "把主要管理注意力集中在掌舵官闭环验证"
    ],
    "evidenceRefs": [
      "E-002",
      "E-003",
      "E-005",
      "E-006"
    ]
  },
  "enterpriseDirection": {
    "statement": "未来90天聚焦完成AI掌舵官三技能可验证经营决策闭环",
    "targetCustomer": "需要用统一决策链完成企业诊断、战略选择和商业模式验证的授权企业",
    "valueFocus": "可追溯、可复用、能约束下游执行的经营决策",
    "boundary": "不同时宣布五个组织正式上线，不在缺少真实数据时确定收益目标",
    "evidenceRefs": [
      "E-002",
      "E-003",
      "E-005",
      "E-006"
    ]
  },
  "developmentPath": [
    {
      "id": "phase-build",
      "sequence": 1,
      "objective": "补齐三技能契约、门禁与项目运行能力",
      "dependsOn": [],
      "exitCriteria": [
        "三个Skill快速校验通过",
        "正常与主要异常路径自动化测试通过"
      ],
      "milestoneRefs": [
        "milestone-contracts"
      ]
    },
    {
      "id": "phase-pilot",
      "sequence": 2,
      "objective": "完成授权企业三技能联合试运行",
      "dependsOn": [
        "phase-build"
      ],
      "exitCriteria": [
        "三个候选企业一致",
        "上游版本与哈希完整",
        "联合门禁通过"
      ],
      "milestoneRefs": [
        "milestone-pilot"
      ]
    },
    {
      "id": "phase-review",
      "sequence": 3,
      "objective": "根据真实证据和帝王验收决定是否升级",
      "dependsOn": [
        "phase-pilot"
      ],
      "exitCriteria": [
        "帝王完成验收并留下明确结果"
      ],
      "milestoneRefs": [
        "milestone-review"
      ]
    }
  ],
  "resourceAllocation": [
    {
      "resourceId": "management-attention",
      "resourceType": "attention",
      "percentage": 50,
      "phaseRef": "phase-build",
      "priority": 1,
      "rationale": "先完成可靠能力底座"
    },
    {
      "resourceId": "management-attention",
      "resourceType": "attention",
      "percentage": 30,
      "phaseRef": "phase-pilot",
      "priority": 2,
      "rationale": "用真实项目验证复用性"
    },
    {
      "resourceId": "management-attention",
      "resourceType": "attention",
      "percentage": 20,
      "phaseRef": "phase-review",
      "priority": 3,
      "rationale": "保留验收、修订和回归容量"
    }
  ],
  "choices": {
    "focus": [
      "完成企业分析、战略规划、商业模式三技能联动",
      "完成真实项目候选、异常路径和全量回归",
      "由帝王完成最终业务验收"
    ],
    "tradeOffs": [
      "用短期覆盖范围换取能力深度和可信度",
      "先保留其他未成熟组织的回退路由"
    ],
    "notDoing": [
      "不同时宣布五个组织全部正式上线",
      "不在无客户和财务证据时确定定价或收益目标",
      "不自动执行投资、招聘、采购或外部发布"
    ]
  },
  "phaseGoals": [
    {
      "id": "goal-build",
      "phase": "days-1-30",
      "objective": "补齐AI掌舵官三个完整Skill及质量门禁",
      "boundary": "只建设本地可逆能力，不对外发布"
    },
    {
      "id": "goal-pilot",
      "phase": "days-31-60",
      "objective": "用至少一个授权企业完成三技能联合试运行",
      "boundary": "缺少真实经营数字时只输出未知项和验证计划"
    },
    {
      "id": "goal-review",
      "phase": "days-61-90",
      "objective": "根据验收结果决定是否升级formal和operational",
      "boundary": "升级状态必须由测试证据和帝王验收共同支持"
    }
  ],
  "resourcePrinciples": [
    "先保障证据、门禁、异常处理和真实试运行，再扩大能力数量",
    "根控制中心只维护组织登记与路由，业务资产留在企业隔离目录",
    "所有外部、付费和重大经营动作单独授权"
  ],
  "assumptions": [
    {
      "assumption": "三技能决策闭环可成为其他组织建设与经营任务的统一上游",
      "evidenceRefs": [
        "E-001",
        "E-005"
      ],
      "trigger": "若真实任务不能复用该闭环，则重新拆分能力边界"
    }
  ],
  "risks": [
    {
      "risk": "内部项目验证不能替代真实外部客户与付费验证",
      "mitigation": "把客户、收入、成本和交付数据明确列为下一阶段未知项",
      "trigger": "帝王授权真实企业或客户场景后重新评估商业结论"
    }
  ],
  "metrics": [
    {
      "id": "metric-skill-contracts",
      "metric": "helmsman_core_skills_with_complete_contracts",
      "baseline": 1,
      "target": 3,
      "evidenceRefs": [
        "E-003"
      ]
    },
    {
      "id": "metric-organizations",
      "metric": "root_registered_organizations",
      "baseline": 5,
      "target": 5,
      "evidenceRefs": [
        "E-001"
      ]
    }
  ],
  "milestones": [
    {
      "id": "milestone-contracts",
      "name": "三个技能完成独立契约与测试",
      "due": "2026-08-27",
      "successCriteria": [
        "三个Skill快速校验通过",
        "正常与主要异常路径自动化测试通过"
      ]
    },
    {
      "id": "milestone-pilot",
      "name": "三技能联合真实项目候选通过",
      "due": "2026-09-26",
      "successCriteria": [
        "三个候选企业一致",
        "上游版本与哈希完整",
        "联合门禁通过"
      ]
    },
    {
      "id": "milestone-review",
      "name": "帝王完成最终验收",
      "due": "2026-10-26",
      "successCriteria": [
        "帝王确认能力满足预期或提出明确修订项"
      ]
    }
  ],
  "ninetyDayPlan": [
    {
      "days": "1-30",
      "actions": [
        "补齐三个Skill、Workflow、Schema、契约、模板和测试",
        "运行正常、异常和边界回归"
      ],
      "owner": "ai-helmsman",
      "metricRefs": [
        "metric-skill-contracts"
      ],
      "phaseGoalRefs": [
        "goal-build"
      ],
      "evidenceRequired": [
        "技能快速校验结果",
        "自动化测试结果"
      ],
      "stopConditions": [
        "同一根因三轮失败",
        "发现跨企业或权限边界问题"
      ]
    },
    {
      "days": "31-60",
      "actions": [
        "完成授权企业三技能候选",
        "记录真实交付时间与资料缺口"
      ],
      "owner": "ai-helmsman",
      "metricRefs": [
        "metric-skill-contracts"
      ],
      "phaseGoalRefs": [
        "goal-pilot"
      ],
      "evidenceRequired": [
        "企业任务目录",
        "知识凭证和候选哈希"
      ],
      "stopConditions": [
        "缺少会改变结论的不可替代企业事实",
        "需要付费或对外动作但未授权"
      ]
    },
    {
      "days": "61-90",
      "actions": [
        "提交帝王验收",
        "根据验收决定状态升级或继续修订"
      ],
      "owner": "ai-helmsman",
      "metricRefs": [
        "metric-organizations"
      ],
      "phaseGoalRefs": [
        "goal-review"
      ],
      "evidenceRequired": [
        "联合门禁结果",
        "帝王验收记录"
      ],
      "stopConditions": [
        "帝王要求修改或不采用",
        "全量回归出现未解决失败"
      ]
    }
  ],
  "downstreamBrief": {
    "businessModel": {
      "inputs": [
        "优先完成三技能决策闭环",
        "未来90天不同时正式化五组织",
        "真实客户和财务数据保持未知",
        "外部商业验证必须单独授权"
      ],
      "decisionsNeeded": [
        "确定首个真实客户或等价价值验证场景",
        "确定允许读取的真实交付、客户和财务数据范围"
      ]
    },
    "executionOrganizations": [
      {
        "organizationId": "control-center",
        "scope": "继续维护唯一主责、能力路由和未成熟组织的回退机制"
      }
    ]
  },
  "decisionsRequired": [
    {
      "decision": "是否采用聚焦AI掌舵官三技能闭环作为未来90天主线",
      "owner": "emperor",
      "executed": false
    },
    {
      "decision": "是否授权下一阶段接入真实客户、交付与财务数据做商业验证",
      "owner": "emperor",
      "executed": false
    }
  ],
  "createdAt": "2026-07-28T00:00:00.000Z"
}
